{
  "schema_name": "norad.run_summary",
  "schema_version": "1.1.0",
  "record_type": "run_summary",
  "run_id": "run_fixture",
  "run_contract": {
    "run_contract_sha256": "284446856367c83d6a7ff61008230d979c33238f77aae087fb87405d9c216245",
    "sample_manifest_sha256": "1111111111111111111111111111111111111111111111111111111111111111",
    "reference_contract_sha256": "2222222222222222222222222222222222222222222222222222222222222222",
    "partition_manifest_sha256": "3333333333333333333333333333333333333333333333333333333333333333",
    "primary_analysis_id": "synthetic_analysis",
    "primary_analysis_policy_sha256": "4444444444444444444444444444444444444444444444444444444444444444"
  },
  "summary_state": "complete",
  "generated_at": "2000-01-01T00:00:04Z",
  "inventory": {
    "path": "tests/fixtures/artifact_schema_v1/source/configs/artifact_inventory.tsv",
    "sha256": "cccccccccccccccccccccccccccccccccccccccccccccccccccccccccccccccc",
    "size_bytes": 256,
    "row_count": 1,
    "media_type": "text/tab-separated-values"
  },
  "artifact_receipt": {
    "path": "tests/fixtures/artifact_schema_v1/source/results/artifacts/run_fixture/run_fixture.artifact_receipt.tsv",
    "sha256": "dddddddddddddddddddddddddddddddddddddddddddddddddddddddddddddddd",
    "size_bytes": 128,
    "row_count": 1,
    "media_type": "text/tab-separated-values"
  },
  "attempts": [],
  "superseded_attempt_ids": [],
  "expected_scopes": [
    {
      "scope": {
        "step_id": "09c",
        "scope_type": "scientific_review",
        "scope_id": "synthetic_review"
      },
      "artifact_ids": [
        "review.synthetic.review_summary"
      ],
      "aggregate_state": "missing",
      "implementation_status": "implemented",
      "local_test_status": "passed",
      "runtime_validation_status": "blocked",
      "cluster_dry_run_status": "not_run",
      "cluster_proof_status": "not_run",
      "warnings": [
        {
          "code": "production_review_missing",
          "message": "No production scientific-review transaction is available.",
          "related_artifact_ids": [
            "review.synthetic.review_summary"
          ],
          "evidence": []
        }
      ],
      "errors": []
    }
  ],
  "artifacts": [
    {
      "schema_name": "norad.artifact_record",
      "schema_version": "1.0.0",
      "record_type": "artifact_record",
      "run_id": "run_fixture",
      "run_contract": {
      "run_contract_sha256": "284446856367c83d6a7ff61008230d979c33238f77aae087fb87405d9c216245",
        "sample_manifest_sha256": "1111111111111111111111111111111111111111111111111111111111111111",
        "reference_contract_sha256": "2222222222222222222222222222222222222222222222222222222222222222",
        "partition_manifest_sha256": "3333333333333333333333333333333333333333333333333333333333333333",
        "primary_analysis_id": "synthetic_analysis",
        "primary_analysis_policy_sha256": "4444444444444444444444444444444444444444444444444444444444444444"
      },
      "artifact_id": "review.synthetic.review_summary",
      "scope": {
        "step_id": "09c",
        "scope_type": "scientific_review",
        "scope_id": "synthetic_review"
      },
      "adapter": "step09c_review_summary_v1",
      "expectation": {
        "required": true,
        "source_path": "tests/fixtures/artifact_schema_v1/source/results/scientific_validation/synthetic_review/synthetic_review.step09c_review_summary.tsv"
      },
      "availability_status": "missing",
      "completion_status": "not_attempted",
      "state_reason": "Production Step 09c evidence is unavailable.",
      "attempt_provenance_status": "not_attempted",
      "attempts": [],
      "selected_attempt_id": null,
      "implementation": {
        "status": "implemented",
        "git_commit": "fixturecommit",
        "evidence": []
      },
    "local_testing": {
      "status": "passed",
      "evidence": [
        {
          "evidence_id": "artifact_schema_test",
          "role": "local_test",
          "path": "tests/contracts/artifacts/test_artifact_schema_contracts.py",
          "sha256": "cccccccccccccccccccccccccccccccccccccccccccccccccccccccccccccccc"
        }
      ]
      },
      "runtime_validation": {
        "status": "blocked",
        "detail": "Production evidence is unavailable.",
        "evidence": []
      },
      "cluster_validation": {
        "dry_run_status": "not_run",
        "proof_status": "not_run",
        "evidence": []
      },
      "source": null,
      "members": [],
      "tools": [],
      "parameters": {},
      "metrics": [],
      "scientific_state": {
        "overall_status": "evidence_incomplete",
        "orientation_status": "provisional",
        "orientation_policy": "legacy_provisional_v1",
        "review_id": "synthetic_review"
      },
      "warnings": [
        {
          "code": "production_review_missing",
          "message": "The expected production review artifact is missing.",
          "related_artifact_ids": [
            "review.synthetic.review_summary"
          ],
          "evidence": []
        }
      ],
      "errors": [],
      "provenance": {
        "producer": "artifact_schema_fixture",
        "producer_version": "1.0.0",
        "git_commit": "fixturecommit",
        "created_at": "2000-01-01T00:00:04Z"
      }
    }
  ],
  "computational_rollup": {
    "expected_artifact_count": 1,
    "complete_artifact_count": 0,
    "missing_artifact_count": 1,
    "incomplete_artifact_count": 0,
    "failed_artifact_count": 0,
    "externally_unavailable_artifact_count": 0,
    "implementation_status": "implemented",
    "local_test_status": "passed",
    "runtime_validation_status": "blocked",
    "cluster_dry_run_status": "not_run",
    "cluster_proof_status": "not_run"
  },
  "scientific_review": {
    "record_state": "missing",
    "source": null,
    "record": null,
    "overall_status": "evidence_incomplete"
  },
  "science_status": "evidence_incomplete",
  "tools": [],
  "parameters": {
    "fixture_kind": "missing_production_science"
  },
  "qc_metrics": [],
  "limitations": [
    {
      "limitation_id": "production_review_missing",
      "status": "open",
      "description": "No production Step 09c review record is available.",
      "impact": "No biological interpretation is permitted.",
      "evidence_ids": []
    }
  ],
  "approved_report_tables": [],
  "candidate_terminology": "CMH-ranked candidates",
  "warnings": [
    {
      "code": "evidence_incomplete",
      "message": "The run summary is structurally complete but scientific evidence is incomplete.",
      "related_artifact_ids": [
        "review.synthetic.review_summary"
      ],
      "evidence": []
    }
  ],
  "errors": [],
  "provenance": {
    "producer": "artifact_schema_fixture",
    "producer_version": "1.0.0",
    "git_commit": "fixturecommit",
    "created_at": "2000-01-01T00:00:04Z"
  }
}
